obligation_id,kind,owned_outcome,test_seam
ADR-005,ADR,explicit human agent code authority,authority rejection
D002,LOCKED_DECISION,declared authority model,human identity and grant
FR-045,FR,separate answer and final decision,separate immutable hashes
FR-046,FR,transactional Harness IR amendment,atomic commit and rollback
FR-047,FR,reopen affected decisions on contradiction,cascade invalidation
FR-048,FR,provisional drafting with human ratification,advisory versus ratified status
FR-049,FR,cascade locked terminal state,all required decisions completed gate
FR-050,FR,complete receipts and resumable memory,replay and resume reconstruction
