source_path,source_family,canonical_namespace,canonical_entry_id,action,rationale
registries/primitives/meaning_plane,primitives.meaning,registry.primitive.meaning,registry.primitive.meaning,move,Meaning-plane primitives become canonical primitive namespace.
registries/primitives/experience_plane,primitives.experience,registry.primitive.experience,registry.primitive.experience,move,Experience-plane primitives become canonical primitive namespace.
registries/composition,composition,registry.composition.template,registry.composition.template,merge,"Composition templates, atlases, and runtime templates converge under canonical composition namespace."
registries/cmf-assembler-schemas,assembler,registry.skill.binding,registry.skill.binding,wrap,Assembler schemas become runtime skill/provider bindings.
registries/evals,evals,registry.eval.rubric,registry.eval.rubric,move,Evaluation definitions become canonical eval rubric namespace.
registries/sda,sda,registry.methodology,registry.methodology.sda,move,SDA ontology becomes methodology registry namespace.
registries/sfl,sfl,registry.methodology,registry.methodology.sfl,move,SFL ontology becomes methodology registry namespace.
